<?xml version="1.0" encoding="UTF-8"?>
<contacts xmlns:xsi="http://www.w3.org/2001/XMLSchema-instance"
	xsi:schemaLocation="contacts contacts.xsd">
	<contact id="11024">
		<method>13510776271</method>
		<contactName>Gykoooooo</contactName>		
		<createDate>2011-09-28 07:10:20</createDate>
	</contact>

	<contact id="1046">
		<method>84236457</method>
		<contactName>翟小斌</contactName>		
		<createDate>2011-09-28 07:10:20</createDate>
	</contact>

	<list id="friends@facebook">
		<contact id="11034">
			<method>46546464646</method>
			<contactName>yuankang</contactName>			
			<createDate>2011-09-28 07:10:20</createDate>
		</contact>
		<contact id="11032">
			<method>156445564641</method>
			<contactName>yuankang</contactName>			
			<createDate>2011-09-28 07:10:20</createDate>
		</contact>
	</list>
</contacts>