<?xml version="1.0" encoding="UTF-8"?>
<contacts xmlns="contact-lists"
	xmlns:xsi="http://www.w3.org/2001/XMLSchema-instance"
	xsi:schemaLocation="contacts contacts.xsd">
	
	<contact id="890">
		<method>13823514039</method>
		<contactName>杨威</contactName>		
		<createDate>2011-09-27 05:26:52</createDate>
	</contact>
	<contact id="891">
		<method>13823514031</method>
		<contactName>abc</contactName>		
		<createDate>2011-09-27 05:26:52</createDate>
	</contact>
	<list id="friends@facebook">
		<contact id="1892">
			<method>13823514031</method>
			<contactName>abc</contactName>			
			<createDate>2011-09-27 05:26:52</createDate>
		</contact>
		<contact id="1893">
			<method>13823514031</method>
			<contactName>abc</contactName>			
			<createDate>2011-09-27 05:26:52</createDate>
		</contact>
	</list>
	<list id="close-friends@facebook">
		<contact id="1894">
			<method>13823514031</method>
			<contactName>abc</contactName>			
			<createDate>2011-09-27 05:26:52</createDate>
		</contact>
		<contact id="1895">
			<method>13823514031</method>
			<contactName>abc</contactName>			
			<createDate>2011-09-27 05:26:52</createDate>
		</contact>
	</list>
</contacts>
