<?xml version="1.0" encoding="UTF-8"?>
<contacts xmlns:xsi="http://www.w3.org/2001/XMLSchema-instance"
	xsi:schemaLocation="contacts contacts.xsd">
	<contact method="13510776272">
		<contactName>Gykooooox</contactName>
	</contact>
	<contact method="84236457">
		<contactName>翟小斌</contactName>
	</contact>
	<contact method="46546464646">
		<contactName>yuankang</contactName>
	</contact>
	<contact method="156445564641">
		<contactName>yuanka</contactName>
	</contact>
</contacts>